{
 "schema_version": 1,
 "kind": "dud.result",
 "run": {
  "run_id": "e15dfd4e-4979-4831-a594-664dff956bc1",
  "mode": "full",
  "dud_version": "0.1.0",
  "mock": false,
  "fixture": null,
  "started_at": "2026-10-31T11:59:30.000Z",
  "finished_at": "2026-10-31T12:59:30.000Z",
  "duration_s": 3600.0,
  "utc_offset_s": 0,
  "options": {
   "gpus": null,
   "load_minutes": 15,
   "skip_dcgm": false,
   "submit": true
  },
  "provider": {
   "reported": "testcloud"
  }
 },
 "host": {
  "driver_version": {
   "value": "550.90.07",
   "status": "ok",
   "source": "smi_xml",
   "raw_ref": "smi_q_x",
   "reason": null,
   "detail": null
  },
  "cuda_driver_version": {
   "value": "12.4",
   "status": "ok",
   "source": "smi_xml",
   "raw_ref": "smi_q_x",
   "reason": null,
   "detail": null
  },
  "nvml_version": {
   "value": "12.550.90.07",
   "status": "ok",
   "source": "nvml",
   "raw_ref": "nvml_snapshot",
   "reason": null,
   "detail": null
  },
  "smi_timestamp": {
   "value": "Sat Oct 31 12:00:00 2026",
   "status": "ok",
   "source": "smi_xml",
   "raw_ref": "smi_q_x",
   "reason": null,
   "detail": null
  },
  "attached_gpus": {
   "value": 1,
   "status": "ok",
   "source": "smi_xml",
   "raw_ref": "smi_q_x",
   "reason": null,
   "detail": null
  },
  "os": {
   "value": "Ubuntu 22.04.4 LTS",
   "status": "ok",
   "source": "os",
   "raw_ref": null,
   "reason": null,
   "detail": null
  },
  "kernel": {
   "value": "5.15.0-105-generic",
   "status": "ok",
   "source": "os",
   "raw_ref": null,
   "reason": null,
   "detail": null
  },
  "cpu_model": {
   "value": "AMD EPYC 9454 48-Core Processor",
   "status": "ok",
   "source": "os",
   "raw_ref": null,
   "reason": null,
   "detail": null
  },
  "environment": {
   "container": {
    "value": "docker",
    "status": "ok",
    "source": "os",
    "raw_ref": null,
    "reason": null,
    "detail": null
   },
   "virtualization": {
    "value": "kvm",
    "status": "ok",
    "source": "os",
    "raw_ref": null,
    "reason": null,
    "detail": null
   },
   "dmi_vendor": {
    "value": null,
    "status": "not_supported",
    "source": "os",
    "raw_ref": null,
    "reason": "file_not_found",
    "detail": "/sys/class/dmi/id/sys_vendor"
   },
   "dmi_product": {
    "value": null,
    "status": "not_supported",
    "source": "os",
    "raw_ref": null,
    "reason": "file_not_found",
    "detail": "/sys/class/dmi/id/product_name"
   },
   "is_root": {
    "value": true,
    "status": "ok",
    "source": "os",
    "raw_ref": null,
    "reason": null,
    "detail": null
   }
  },
  "kernel_log": {
   "value": "dmesg",
   "status": "ok",
   "source": "kernel_log",
   "raw_ref": "kernel_log",
   "reason": null,
   "detail": null
  },
  "topology": {
   "value": {
    "columns": [
     "GPU0",
     "CPU Affinity",
     "NUMA Affinity",
     "GPU NUMA ID"
    ],
    "rows": {
     "GPU0": {
      "GPU0": "X",
      "CPU Affinity": "0-27",
      "NUMA Affinity": "0",
      "GPU NUMA ID": "N/A"
     }
    }
   },
   "status": "ok",
   "source": "smi_topo",
   "raw_ref": "smi_topo_m",
   "reason": null,
   "detail": null
  }
 },
 "gpus": [
  {
   "index": 0,
   "pci_bus_id": "00000000:18:00.0",
   "card": {
    "hash_scheme": "dud-card-v1",
    "uuid_sha256": {
     "value": "3d2bc294cd22fb8af85936a25c9f9fae0d5c9d1b5eedd9de69edec06a74e752a",
     "status": "ok",
     "source": "derived",
     "raw_ref": "smi_q_x",
     "reason": null,
     "detail": null
    },
    "serial_sha256": {
     "value": "d3e66efedf5638c30cee2f945e9cc6a1b279b408c786acd4fe38da2e491e7e86",
     "status": "ok",
     "source": "derived",
     "raw_ref": "smi_q_x",
     "reason": null,
     "detail": null
    }
   },
   "identity": {
    "name": {
     "value": "NVIDIA H100 80GB HBM3",
     "status": "ok",
     "source": "smi_xml",
     "raw_ref": "smi_q_x",
     "reason": null,
     "detail": null
    },
    "model_key": {
     "value": "H100-SXM5-80GB",
     "status": "ok",
     "source": "derived",
     "raw_ref": null,
     "reason": null,
     "detail": null
    },
    "form_factor": {
     "value": "SXM",
     "status": "ok",
     "source": "derived",
     "raw_ref": null,
     "reason": null,
     "detail": null
    },
    "architecture": {
     "value": "Hopper",
     "status": "ok",
     "source": "smi_xml",
     "raw_ref": "smi_q_x",
     "reason": null,
     "detail": null
    },
    "vbios": {
     "value": "96.00.99.00.01",
     "status": "ok",
     "source": "smi_xml",
     "raw_ref": "smi_q_x",
     "reason": null,
     "detail": null
    },
    "board_part_number": {
     "value": "692-2G520-0200-000",
     "status": "ok",
     "source": "smi_xml",
     "raw_ref": "smi_q_x",
     "reason": null,
     "detail": null
    },
    "pci_device_id": {
     "value": "233010DE",
     "status": "ok",
     "source": "smi_xml",
     "raw_ref": "smi_q_x",
     "reason": null,
     "detail": null
    },
    "pci_subsystem_id": {
     "value": "16C110DE",
     "status": "ok",
     "source": "smi_xml",
     "raw_ref": "smi_q_x",
     "reason": null,
     "detail": null
    },
    "inforom_image": {
     "value": "G520.0200.00.05",
     "status": "ok",
     "source": "smi_xml",
     "raw_ref": "smi_q_x",
     "reason": null,
     "detail": null
    },
    "gsp_firmware": {
     "value": "550.90.07",
     "status": "ok",
     "source": "smi_xml",
     "raw_ref": "smi_q_x",
     "reason": null,
     "detail": null
    },
    "memory_total_mib": {
     "value": 81559,
     "status": "ok",
     "source": "smi_xml",
     "raw_ref": "smi_q_x",
     "reason": null,
     "detail": null
    },
    "power_limit_default_w": {
     "value": 700.0,
     "status": "ok",
     "source": "smi_xml",
     "raw_ref": "smi_q_x",
     "reason": null,
     "detail": null
    },
    "power_limit_current_w": {
     "value": 700.0,
     "status": "ok",
     "source": "smi_xml",
     "raw_ref": "smi_q_x",
     "reason": null,
     "detail": null
    },
    "power_limit_max_w": {
     "value": 700.0,
     "status": "ok",
     "source": "smi_xml",
     "raw_ref": "smi_q_x",
     "reason": null,
     "detail": null
    },
    "pcie": {
     "gen_max": {
      "value": 5,
      "status": "ok",
      "source": "smi_xml",
      "raw_ref": "smi_q_x",
      "reason": null,
      "detail": null
     },
     "gen_current": {
      "value": 5,
      "status": "ok",
      "source": "smi_xml",
      "raw_ref": "smi_q_x",
      "reason": null,
      "detail": null
     },
     "width_max": {
      "value": 16,
      "status": "ok",
      "source": "smi_xml",
      "raw_ref": "smi_q_x",
      "reason": null,
      "detail": null
     },
     "width_current": {
      "value": 16,
      "status": "ok",
      "source": "smi_xml",
      "raw_ref": "smi_q_x",
      "reason": null,
      "detail": null
     }
    },
    "mig_mode": {
     "value": false,
     "status": "ok",
     "source": "smi_xml",
     "raw_ref": "smi_q_x",
     "reason": null,
     "detail": null
    },
    "persistence_mode": {
     "value": true,
     "status": "ok",
     "source": "smi_xml",
     "raw_ref": "smi_q_x",
     "reason": null,
     "detail": null
    },
    "compute_mode": {
     "value": "Default",
     "status": "ok",
     "source": "smi_xml",
     "raw_ref": "smi_q_x",
     "reason": null,
     "detail": null
    },
    "max_clocks": {
     "sm_mhz": {
      "value": 1980,
      "status": "ok",
      "source": "smi_xml",
      "raw_ref": "smi_q_x",
      "reason": null,
      "detail": null
     },
     "mem_mhz": {
      "value": 2619,
      "status": "ok",
      "source": "smi_xml",
      "raw_ref": "smi_q_x",
      "reason": null,
      "detail": null
     }
    },
    "fabric_state": {
     "value": "Completed",
     "status": "ok",
     "source": "smi_xml",
     "raw_ref": "smi_q_x",
     "reason": null,
     "detail": null
    },
    "nvlink": {
     "value": {
      "links_total": 18,
      "links_active": 18,
      "states": [
       true,
       true,
       true,
       true,
       true,
       true,
       true,
       true,
       true,
       true,
       true,
       true,
       true,
       true,
       true,
       true,
       true,
       true
      ]
     },
     "status": "ok",
     "source": "nvml",
     "raw_ref": "nvml_snapshot",
     "reason": null,
     "detail": null
    }
   },
   "history": {
    "ecc_mode": {
     "value": true,
     "status": "ok",
     "source": "smi_xml",
     "raw_ref": "smi_q_x",
     "reason": null,
     "detail": null
    },
    "ecc_mode_pending": {
     "value": true,
     "status": "ok",
     "source": "smi_xml",
     "raw_ref": "smi_q_x",
     "reason": null,
     "detail": null
    },
    "ecc": {
     "volatile": {
      "correctable": {
       "value": 5,
       "status": "ok",
       "source": "smi_xml",
       "raw_ref": "smi_q_x",
       "reason": null,
       "detail": null
      },
      "uncorrectable": {
       "value": 2,
       "status": "ok",
       "source": "smi_xml",
       "raw_ref": "smi_q_x",
       "reason": null,
       "detail": null
      },
      "detail": {
       "value": {
        "sram_correctable": 0,
        "sram_uncorrectable_parity": 0,
        "sram_uncorrectable_secded": 0,
        "dram_correctable": 5,
        "dram_uncorrectable": 2
       },
       "status": "ok",
       "source": "smi_xml",
       "raw_ref": "smi_q_x",
       "reason": null,
       "detail": null
      }
     },
     "aggregate": {
      "correctable": {
       "value": 41,
       "status": "ok",
       "source": "smi_xml",
       "raw_ref": "smi_q_x",
       "reason": null,
       "detail": null
      },
      "uncorrectable": {
       "value": 0,
       "status": "ok",
       "source": "smi_xml",
       "raw_ref": "smi_q_x",
       "reason": null,
       "detail": null
      },
      "detail": {
       "value": {
        "sram_correctable": 0,
        "sram_uncorrectable_parity": 0,
        "sram_uncorrectable_secded": 0,
        "dram_correctable": 41,